{
  "schemaVersion": 1,
  "id": "presentations",
  "name": "Presentations",
  "description": "Basic PPTX editing and presentation with best-effort compatibility.",
  "version": "0.20.2.17",
  "enabled": true,
  "optional": false,
  "order": 30,
  "entryPoint": "apps/presentations/index.html",
  "icon": "assets/icons/presentations.png",
  "badge": "P",
  "themeClass": "presentations",
  "accent": "#d64a24",
  "extensions": [
    "pptx"
  ],
  "mimeTypes": [
    "application/vnd.openxmlformats-officedocument.presentationml.presentation"
  ],
  "capabilities": [
    "open",
    "new",
    "edit-basic",
    "copy-export",
    "presentation-mode",
    "local-recovery-snapshots",
    "local-processing"
  ]
}
