{
  "schemaVersion": 1,
  "id": "txt",
  "name": "Plain Text",
  "description": "A simple local TXT viewer and editor with a yellow notebook identity.",
  "version": "0.20.0",
  "enabled": true,
  "optional": true,
  "order": 50,
  "entryPoint": "apps/txt/index.html",
  "icon": "assets/icons/txt.png",
  "badge": "TXT",
  "themeClass": "txt",
  "accent": "#d9a514",
  "extensions": [
    "txt"
  ],
  "mimeTypes": [
    "text/plain"
  ],
  "capabilities": [
    "open",
    "new",
    "edit-basic",
    "copy-export",
    "find",
    "word-wrap",
    "font-size",
    "editable-file-title",
    "unsaved-change-navigation-warning",
    "local-processing"
  ]
}
