{
  "schemaVersion": 1,
  "id": "pdf",
  "name": "PDF Workspace",
  "description": "Local PDF rendering, forms, navigation and a private review layer.",
  "version": "0.20.2.20",
  "enabled": true,
  "optional": false,
  "order": 40,
  "entryPoint": "apps/pdf/index.html",
  "icon": "assets/icons/pdf.png",
  "badge": "PDF",
  "themeClass": "pdf",
  "accent": "#b42318",
  "extensions": [
    "pdf"
  ],
  "mimeTypes": [
    "application/pdf"
  ],
  "capabilities": [
    "open",
    "view",
    "forms",
    "navigation",
    "review-sidecar",
    "local-processing"
  ]
}
